<?xml version="1.0" encoding="UTF-8"?>

<vendeglatas xmlns:xsi="http://www.w3.org/2001/XMLSchema-instance" xsi:noNamespaceSchemaLocation="XVG56E_XMLSchema.xsd">

    <!-- Étterem-->
    <etterem ekod="e1">
        <nev>Trófea</nev>
        <cim>
            <varos>Budapest</varos>
            <utca>Visegrádi</utca>
            <hazszam>13</hazszam>
        </cim>
        <csillag>4</csillag>
    </etterem>

    <etterem ekod="e2">
        <nev>Gundel</nev>
        <cim>
            <varos>Budapest</varos>
            <utca>Gundel Károly</utca>
            <hazszam>4</hazszam>
        </cim>
        <csillag>5</csillag>
    </etterem>

    <!-- Főszakács-->
    <foszakacs fkod="f1" e_f="e1">
        <nev>Havas Péter</nev>
        <eletkor>35</eletkor>
        <vegzetseg>Szakközépiskola</vegzetseg>
        <vegzetseg>Instuit Paul Bocuse</vegzetseg>
    </foszakacs>

    <foszakacs fkod="f2" e_f="e2">
        <nev>Nagy Károly</nev>
        <eletkor>30</eletkor>
        <vegzetseg>Le Cordon Bleu</vegzetseg>
    </foszakacs>

    <!-- Szakács-->
    <szakacs szkod="sz1" e_sz="e1">
        <nev>Ötlet Elek</nev>
        <reszleg>Saucier</reszleg>
        <vegzetseg>Szakközépiskola</vegzetseg>
        <vegzetseg>Le Cordon Bleu</vegzetseg>
        <vegzetseg>Instuit Paul Bocuse</vegzetseg>
    </szakacs>

    <szakacs szkod="sz2" e_sz="e2">
        <nev>Kocsis Tibor</nev>
        <reszleg>Entrematier</reszleg>
        <vegzetseg>Szakközépiskola</vegzetseg>
        <vegzetseg>Le Cordon Bleu</vegzetseg>
    </szakacs>

    <szakacs szkod="sz3" e_sz="e2">
        <nev>Tálas Levente</nev>
        <reszleg>Gardemanger</reszleg>
        <vegzetseg>Szakközépiskola</vegzetseg>
    </szakacs>

    
    <szakacs szkod="sz4" e_sz="e1">
        <nev>Szűcs Judit</nev>
        <reszleg>Entrematier</reszleg>
        <vegzetseg>Le Cordon Bleu</vegzetseg>
        <vegzetseg>Instuit Paul Bocuse</vegzetseg>
    </szakacs>

    <!-- Gyakornok-->
        <gyakornok gykod="gy1" e_gy="e1">
            <nev>Bordás Dávid</nev>
            <gyakorlat>
                <kezdete>2021.08.20</kezdete>
                <idotartama>2 hónap</idotartama>
            </gyakorlat>
            <muszak>Délelőtt</muszak>
            <muszak>Este</muszak>
        </gyakornok>
        
        <gyakornok gykod="gy2" e_gy="e2">
            <nev>Szilágyi István</nev>
            <gyakorlat>
                <kezdete>2021.06.01</kezdete>
                <idotartama>4 hónap</idotartama>
            </gyakorlat>
            <muszak>Délután</muszak>
        </gyakornok>

        <gyakornok gykod="gy3" e_gy="e1">
            <nev>Szentpétery Ferenc</nev>
            <gyakorlat>
                <kezdete>2021.07.15</kezdete>
                <idotartama>3 hónap</idotartama>
            </gyakorlat>
            <muszak>Este</muszak>
        </gyakornok>

    <!-- Vendég-->
     <vendeg vkod="v1">
        <nev>Fekete Péter</nev>
        <eletkor>21</eletkor>
        <cim>
            <varos>Miskolc</varos>
            <utca>Márton</utca>
            <hazszam>17</hazszam>
        </cim>
     </vendeg>

     <vendeg vkod="v2">
        <nev>Bordás Áron</nev>
        <eletkor>25</eletkor>
        <cim>
            <varos>Eger</varos>
            <utca>Dobó</utca>
            <hazszam>12</hazszam>
        </cim>
     </vendeg>

     <!-- Rendelés-->

     <rendeles e_v_e="e1" e_v_v="v1">
        <osszeg>8000</osszeg>
        <etel>Kaviár</etel>
     </rendeles>

     <rendeles e_v_e="e2" e_v_v="v2">
        <osszeg>20000</osszeg>
        <etel>Zsíros kenyér</etel>
     </rendeles>
     
     <rendeles e_v_e="e1" e_v_v="v2">
        <osszeg>300</osszeg>
        <etel>Mackó sajt</etel>
     </rendeles>
     
     <rendeles e_v_e="e2" e_v_v="v1">
        <osszeg>9000</osszeg>
        <etel>Steak</etel>
     </rendeles>
</vendeglatas>